Article,Summary,Time,model
"Famous Italian designers like Fendi, Gucci and Prada may be toted by celebrities such as Rihanna, Kate Moss and Katy Perry, but few are probably aware of the history behind the brands they wear. A new book has now archived the changing face of Italian fashion, from the post-war years to the 21st century. Italian Glamour: The Essence of Italian Fashion, From the Postwar Years to the Present Day, captures the evolution of Mediterranean style through 300 iconic dresses and archived images. Model Joan Olsen (left) shows off bold linear prints in an outfit by haute couture designer/artist Livio de Simone in 1954. Co-author Enrico says that Italian glamour is not 'sophisticated or artificial' The book was compiled by Enrico Quinto and Paolo Tinarelli - the two men who  were the first to introduce the concept of vintage style in Italy . The volume has been compiled by Enrico Quinto, 51, and Paolo Tinarelli, 49. The two men established the first flea market in Rome and were the first to introduce the concept of vintage in Italy. Enrico revealed that they wanted to honour the Italian designers who have helped to make the country a fashion powerhouse. He said: 'The pioneers that have really put Italy on the map of international fashion have been Emilio Pucci in the Fifties, Missoni and Krizia in the Sixties, Giorgio Armani and Gianni Versace in the Seventies and Eighties, and Dolce & Gabbana, Prada and Gucci in the Nineties.' Fifties cover girl Ivy Nicholson wears Emilio Pucci in Capri, 1953. The book talks about how the start of many Italian fashion powerhouses started out with a real focus on craftsmanship . The book focuses on the humble beginnings of some of the world's biggest Italian brands and how they rose to cultural significance. It  looks at how designers such as Miuccia Prada, Giorgio Armani and Adele Casagrande, founder of Fendi, have created a legacy within their labels. Many Italian powerhouses started out with a focus on craftsmanship, using work methods and decorative traditions that were passed down through generations. Post-war economic development in the fifties saw the expansion of the advertising industry into high fashion. Designers such as Alma Maria Lami constructed clothes that were decorated with a patchwork of ideas and activities . The book also explores momentous periods which truly characterised Italian fashion. For example, post-war economic development in the Fifties saw the expansion of the advertising industry into high fashion. Designers like Alma Maria Lami constructed clothes that were decorated with patchworks of cartoon-like ideas and activities, which subtly influenced buyers. A woman wears a structural suit by Fernandi, at a time when Italian fashion was beginning to break away from Parisian style . In the mid-fifties, Emilio Frederico Schuberth created an outfit which had a removable over-skirt so that the wearer could opt for a straight or flared silhouette . Another poignant moment came in the mid-Fifties, where Italian fashion began to break away from what Parisian style dictated. Creative directors such as Emilio Frederico Schuberth began to create structurally innovative creations. Italian Glamour also looks at breakthrough moments for Italian fashion, such as one of the first runway showcases in Florence, which saw the artistic city overtake Paris as the global fashion capital. From that moment on, styles quickly progressed. By the mid-Forties, Italian designers began to take their inspiration from Hollywood femme fatales rather than Parisian fashion. Religion was also an inspiration, which explains the high-necks and dark tones often seen in that period. The moment Italian fashion made its breakthrough, at the grand hall in Florence's Palazzo Pitti in 1951 . A model is pictured in Italy in 1953. In the mid-forties, Italian designers began to take their inspiration from Hollywood femme fatales rather than Parisian fashion. Religion was also an inspiration, which explains the high-necks and dark tones . Model Liliana Mongini wears Germana Marucelli in January 1950. Marucelli was the first Italian post-war designer - her designs were on several occasions interpreted by Christian Dior . In fact, Parisian fashion soon began to follow the lead of Italian innovators. Germana Marucelli was the first Italian post-war designer, and her designs were, on several occasions, interpreted by Frenchman Christian Dior. The book also examines how trends developed over the years and iconic celebrity moments that would cement a designer's fame. One in particular came in 1956, when Italian-French film star Sophia Loren wore a sweeping gown by Emilio Schuberth at the Cannes Festival. Schuberth became known as the 'tailor to the stars', and also catered for the likes of Rita Hayworth and Brigitte Bardot. His students included Valentino Garavani - who continues to be an Italian powerhouse today. Impossibly glamorous: In 1956, Italian-French film star Sophia Loren wore a sweeping gown by Emilio Schuberth at the Cannes Festival . This dress by Emilio Schuberth cemented his position as 'tailor to the stars' Late sixties and early seventies creations from Fendi, including the bag with the signature interlocking Fs (right) Examples of humble beginnings are especially surprisingly when looking at labels such as Fendi - who originally came into existence as a leather and fur shop in Rome. From the mid-Sixties, Karl Lagerfeld was involved in the design of Fendi's logo with the interlocking F letters. Several designers in the book, such as Federico Forquet, are no longer operational, but were important in influencing and shaping the overall movement and progression of Italian fashion. The book also highlights how certain Italian designers, such as Roberto Carpucci, were propelled to fame when clothes were featured in advertorials - eventually appearing in publications such as Vogue. A piece from Italian designer Federico Forquet, in his autumn/winter 1965 collection . Renowned Italian designer, Roberto Carpucci's structural designs featured in Vogue Italia in 1982 . A defining moment for Italian fashion was circa 1994; Elizabeth Hurley stepped out in a Versace safety pin gown that was to become one of the most iconic dresses of all time. From then on, it seemed that Italian fashion was the pinnacle of daring style. Co-author of the book, Enrico Quinto says that Italian glamour is 'in the DNA of an Italian's lifestyle'. He adds: 'Italian glamour is not sophisticated or artificial; it keeps conscious of the female's body, and it works in the same way as the idea of 'Dolce Far Niente' - the sweetness of doing nothing. It's an accessible beauty - simple and natural.' Elizabeth Hurley in 1994 (left), pictured with then-beau, Hugh Grant (right) wearing the Versace dress that would go down in fashion history . Liz Hurley's dress (pictured) was a creation from Gianni Versace's spring/summer 1994 collection . In fact, Italian style has made a huge contribution to the fashion industry today, with Milan Fashion Week still a crucial part of the circuit, and with young models such as Kendall Jenner flocking to Milan every year. Popular culture figures such as Rihanna, are also active lovers of the Italian style. Rihanna recently customised a Fendi Baguette bag for a charity auction, along with Sarah Jessica Parker. Rihanna toting not one but two of her customised Baguette bags with Fendi at the launch . Successful models such as Kendall Jenner (pictured) flock to Milan Fashion Week every season to walk in shows such as Dolce & Gabbana (left - Autumn/Winter 2015, right - Spring/Summer 2015). Italian style is very much still crucial to the fashion landscape . In terms of the state of Italian glamour now, Enrico argues that it is a changing landscape, but something that maintains its simplicity. 'Italy has become more global and the melting pot of different nationalities has automatically brought new influences into Italy's lifestyle. 'I believe that  the essence of Italian glamour is based on a certain 'minimalism'. Clothing still has to be practical and adapted to an understated lifestyle. Italian Glamour: The Essence of Italian Fashion, From the Postwar Years to the Present Day (Skira Editore) is out on 30 March 2015.","Released in 2015, 'Italian Glamour: The Essence of Italian Fashion' by Enrico Quinto and Paolo Tinarelli chronicles the growth of Italian sartorial powerhouses like Gucci and Prada. It explores how Italian designers, including Emilio Pucci and Fendi began with a focus on craftsmanship, leading to a vibrant fashion culture that drew inspiration from diverse sources like Hollywood. The book also delves into significant events like Florence's rise as a fashion capital, disrupting Paris' dominance.",2.460714101791382,finetuned-76
"Multiple ghosts supposedly inhabit an expensive New York City apartment building, which recently added Academy Award-nominated actress Jessica Chastain to its list of occupants. Two residents from the Osborne Apartments on West 57th Street in Manhattan told the New York Post of their experiences with spirits in the building. Chastain and her boyfriend, Gian Luca Passi de Preposulo, spent $5.1 million on an apartment that features four bedrooms and 3.5 bathrooms, Daily Mail Online reported early last month. Chastain most recently appeared on the big screen in the 2014 films Interstellar and A Most Violent Year. Purchase: Jessica Chastain recently purchased a $5.1 million apartment at The Osborne. The building is supposedly haunted by spirits . Friendly ghosts? The ghosts of opera singer Johanna Gadski (left) and Alfredo Taylor (right) are thought to haunt the Osborne Apartments on West 57th Street . Residence: Chastain's new home at The Osborne (pictured) features four bedrooms and 3.5 bathrooms . Convenient: The space is located in New York City's Midtown neighborhood and not far from Central Park . Relax: The space features high ceiling and windows that let lots of light in . The Osborne is located close to Carnegie Hall and is a few blocks away from Columbus Circle, Central Park and Lincoln Center. One of The Osborne's longtime residents, Naomi Guffman, recently told the Post 'I have a poltergeist!' She thinks the ghost is actually one of the apartment's former tenants, Metropolitan Opera singer Johanna Gadski, according to the newspaper. The Post described Gadski as 'a red-haired practical joker' who was killed in a 1932 Berlin car accident. Guffman told the Post '[Me and my husband would] be standing in the hallway talking and the toilet would start to flush.' She also described doors randomly opening and water on the stove boiling of its own accord. Retreat: Chastain and her boyfriend Gian Luca Passi de Preposulo can hideaway in one of the apartment's four bedrooms . Classic: The apartment also features lots of wood paneling and design elements . Macabre: Ghosts supposedly inhabit The Osborne, according to some of its residents . In 1971, fellow resident Davida Deutsch and her husband heard a booming noise the first night they spent in their apartment and woke up, the newspaper reported. The couple earlier placed a broom close by and were already aware of ghost speculation, according to the Post. The newspaper reported that the Osborne Apartments are allegedly haunted by architect Alfredo Taylor's ghost as he takes the elevator and walks around hallways. Taylor came up with the plan for the building's 1906 addition. Taylor is also known for being the architect behind multiple buildings in Norfolk, Connecticut. The Osborne's resident manager John Coyne told the Post of Taylor 'I haven’t come across anything strange. I don’t know if that means if he's moved on or he's moved out.' MailOnline reported last month that in 1978, the bodies of actors Gig Young and Kim Schmidt were found in an apartment at The Osborne, supposedly the result of a murder-suicide carried out by Young. Nap time: Another bedroom in the apartment is seen with windows looking out toward other New York City buildings in the neighborhood . Unwind: Chastain's apartment also includes a sitting room with high ceilings and wood detailing .","Academy Award nominee Jessica Chastain and partner Gian Luca Passi de Preposulo now own a $5.1M four-bedroom apartment at NY's haunted Osborne building, joined by resident spirits like Johanna Gadski and architect Alfredo Taylor. As reported by Naomi Guffman, and Davida Deutsch, there's noticeable paranormal activity such as flushing toilets, opened doors, and self-boiling stoves. The location, near Central Park, Carnegie Hall, and Lincoln Center, offers a prime Midtown retreat.",1.7227997779846191,finetuned-76
"UKIP leader has vowed to stand down as leader if the party fails to breakthrough in next year's election . Nigel Farage has vowed to resign as party leader if UKIP fails to achieve a general election breakthrough next year. The UKIP leader said there was ‘not one ounce of complacency from me’ after he was selected last night to stand in the South Thanet seat for UKIP at next year's general election. His nomination was overshadowed by Boris Johnson’s decision to throw his hat into the ring to be the next MP for Uxbridge in west London. But Mr Farage said he confident that the Tories would lose votes to UKIP at the next election. He said: ‘I'm not pretending for one moment that it's going to be easy, but Ukip is offering something different and distinctive. ‘If we'd failed in the European elections I would have stood down, if we fail next year the party will pick someone better than me, but do you know what? That ain't going to happen.’ Mr Farage meanwhile told The Telegraph that Mr Johnson will be a ‘problem’ for the Tories after the next election. He said: ‘He [Boris] will be a problem for the Conservatives. He will appeal to the Tory grassroots, and have that little certain something that Mr Cameron appears to be struggling with.’ Mr Farage added: ‘While Boris on a good day sounds fairly Eurosceptic, and says that we must do this, that, and the other, the reality is that this is the same Boris who advocated an amnesty for all of the illegal immigrants in London a Boris who on a tour of India last year said EU membership was vital to the British economy. ‘So yes, Boris Johnson is engaging, people like him, but in policy terms, certainly at the moment, he’s a long way from the position that our voters are really looking for.’ He said: ‘Ukip will be a force in the House of Commons next year and if we get this right we may find ourselves in a hung parliament holding the balance of power.’ Leaked polling suggested that UKIP will target seats on the east and south coast of England held by Tory MPs, including three government ministers. The revelation reignited fears among the Conservatives that a strong UKIP performance could split right-wing voters and help Ed Miliband into power. However, speaking after his selection, Mr Farage said that his party will target Labour too: ‘Somebody once said I was David Cameron's worst nightmare. Well that's not true, I want to be Ed Miliband's worst nightmare too. This idea that Ukip voters are all ex Tories is baloney.’ London Mayor Boris Johnson will be used by the Tories to undermine the appeal of Nigel Farage and UKIP in the next election . Mr Farage’s comments come as polls showed more voters welcome the return of Mr Johnson to Parliament than the prospect of UKIP winning seats next year. A survey by YouGov has found 57 per cent of the public believes the London mayor’s decision to return to Parliament is ‘good thing’. Two thirds also believe it is likely that he will one day lead the Conservative party. By contrast, just 33 per cent think Mr Farage's candidature for Ukip in South Thanet is a positive thing, versus 54 per cent who think the opposite.","Nigel Farage, UKIP leader, promises to resign if the party fails in next year's election. Despite Boris Johnson's entry in Uxbridge poll, Farage is confident of Conservative vote loss to UKIP. Farage perceives Johnson as a threat to Cameron, doubting his Eurosceptic stance. Leaked polls identify UKIP eyeing Tory-held coastal seats and targeting Labour as well. Public opinion in favour of Johnson's return to Parliament surpasses Farage's candidacy.",1.6202771663665771,finetuned-76
"By . Daily Mail Reporter . PUBLISHED: . 20:03 EST, 22 July 2013 . | . UPDATED: . 02:55 EST, 23 July 2013 . Tories in the Treasury were accused yesterday of blocking moves to charge for plastic carrier bags in English supermarkets. Liberal Democrats said there was conclusive proof charging would cut the use of plastic bags, but the Treasury did not want to force a levy on supermarkets before the election because it would be unpopular with voters. England is the only part of the UK holding out against the policy. Charges are already in effect in Wales and Northern Ireland, and Scotland is planning to introduce one next year. England is the only part of the UK holding out against the policy. Charges are already in effect in Wales and Northern Ireland, and Scotland is planning to introduce one next year . A senior Lib Dem said: ‘It is the Tories in the Treasury who are blocking this. ‘They believe households would hate it, and that that is more important than the environmental consequences.’ While the issue has divided Coalition ministers, some Conservative MPs, including Zac Goldsmith, David Cameron¿s former green adviser, support a levy . The Mail’s Banish the Bags campaign has . highlighted their devastating impact on the environment and wildlife. Plastic carrier bags from supermarkets are used for an average of just . 20 minutes, but survive for hundreds of years, littering the landscape . and killing marine animals that eat or get tangled in them. In Wales, where a 5p levy has been in place for over a year, there has been an 81 per cent drop in usage as shoppers take their own bags to stores. The Department for Environment, Food and Rural Affairs is officially still examining the evidence from Wales.Figures this month revealed the number of bags handed out by supermarkets in England has soared by more than 12 per cent in two years, to seven billion. While the issue has divided Coalition ministers, some Conservative MPs, including Zac Goldsmith, David Cameron’s former green adviser, support a levy. Yesterday a Lib Dem source said: ‘It is still something the party supports, as do many Tories, but there is no movement from the Treasury on it.’ A Treasury source said: ‘There are arguments for and against it. All options are being discussed.’ Earlier this year, the Lib Dems’ environment spokesman in the Lords, Baroness Parminter of Godalming, said charges would deliver financial as well as environmental benefits, as householders pay the ‘hidden costs’ of disposing of millions of plastic bags in their council tax bills. The Mail¿s Banish the Bags campaign has highlighted their devastating impact on the environment and wildlife .","The English Conservative-led Treasury is accused of thwarting Liberal Democrats' efforts to implement plastic bag charges, unlike Wales, Northern Ireland, and Scotland. The Mail's Banish the Bags campaign raises awareness about their long-lasting harm on nature. Despite coalition divisions, notably backed by Tories such as former advisor Zac Goldsmith, Treasury's concern about voter repercussion trumps environmental consequences. Bag usage in England rose by 12%, reaching seven billion. Lib Dems link charges to council tax, citing Baroness Parminter.",2.338304042816162,finetuned-76
"British scientists are calling for anorexia sufferers to join a ground-breaking study to find the genes that may cause the condition. Researchers from King’s College London have joined forces with experts from around the world in  an effort to prove that victims are born with the illness. Anorexia affects about 1.6 million people in Britain alone. Charlotte Bevan, who died in January, and her daughter Georgie who was diagnosed with anorexia aged 12 . In the largest example of genetic research ever done into the eating disorder, King’s has already analysed the DNA of more than  300 former anorexia sufferers. Their target is 25,000 DNA samples worldwide, including 1,000 volunteers from Britain. Brooks Newmark, the Minister for Civil Society, who last year revealed that he had suffered from anorexia, has already donated his DNA. The global project, called AN25K, was launched by Cynthia Bulik,  a professor in the field of eating disorders at the University of  North Carolina. After carrying out research into anorexia in twins in 2007, she discovered that the illness can be inherited, and that more than half the risk of developing the disorder is due to genetic factors. She said: ‘We know very little about the biology of anorexia and hopefully by identifying these genes we will be able to develop new treatments. It is not just one gene – it will be hundreds of genes.’ Ground-breaking: In the largest example of genetic research ever done into the eating disorder, King's has already analysed the DNA of more than  300 former anorexia sufferers . The UK research is backed by the charity Charlotte’s Helix, set up in memory of Charlotte Bevan, a farmer’s wife who died aged 48 in January. Her daughter Georgie was diagnosed with anorexia aged 12. Charlotte rapidly became aware of the stigma associated with the illness and was frustrated by the lack of scientific research being done. She was convinced that her daughter’s eating disorder was in her DNA and that Georgie had not chosen to be anorexic. After . being diagnosed with terminal cancer, Charlotte wrote a book on . anorexia designed to help parents. She also founded the charity to . collect the DNA of anorexia sufferers and fund research into the . illness. In . her book, Throwing Starfish Across The Sea, Charlotte wrote: ‘I want . people to stop being afraid  and ashamed of something that is not their . fault. I want to educate the 99 per cent of the world that don’t know or . don’t care that the eating disorder world deserves a voice. ‘I . want people to know that my daughter is not a vain, mindless bimbo who . just wants to be thin, but a stellar, brilliant, important part of the . community who just happens to have a brain blip.’ Gerome . Breen, a senior lecturer at King’s, is leading the AN25K project. He . said: ‘What we want to discover is are genetics and biology behind the . illness, because if we can find the biology behind the illness, we can . design specific treatments. We want to help sufferers survive.’ Erica Husain, a friend of Charlotte and chairman of the charity, said: ‘We knew we were going to keep this going for her. We wanted to find a way to carry research forward, to bring this research to the UK and put Charlotte’s name on it.’ She added: ‘There are still a lot of myths and tales and this is something  that can give us some reality, some science. People will then understand that an eating disorder is not an illness of choice.’ The research has been backed by Britain’s leading centre for eating disorders, the Eating Disorders Unit at the Bethlem Royal Hospital, which is part of South London and Maudsley NHS Foundation Trust. Janet Treasure, the unit’s director, said: ‘The research looking at interactions between genes and the environment is invaluable because it does take away a bit of the guilt and confusion from families who are dealing with eating disorders.’ Charlotte’s Helix has no government funding and relies on donations to pay for DNA samples to be taken.","King’s College London collaborates with global experts to launch AN25K, the largest genetic study on anorexia worldwide, targeting 25,000 DNA samples including 1,000 from Britain. Charlotte’s Helix, a charity initiated by Charlotte Bevan's demise, aids this groundbreaking research. Brooks Newmark, UK’s Minister for Civil Society, contributes his DNA. AN25K aims to identify numerous implicated genes to develop enhanced treatments for anorexia.",2.129455804824829,finetuned-76
