Article,Summary,Time,model
"By . Jessica Jerreat . PUBLISHED: . 09:00 EST, 19 June 2013 . | . UPDATED: . 16:48 EST, 19 June 2013 . With only days to go before his daredevil wire walk across the Grand Canyon without a safety harness and live on television, Nik Wallenda has released a stomach churning video of what his daring feat will involve. The sky walker is seen walking between two looming buildings in his home town of Sarasota, Florida, and fighting to keep his balance as giant fans are directed at him to recreate conditions at the Grand Canyon. Crowds of spectators have been gathering every day to watch as Wallenda and his team practice for  his 1,200ft walk without tethers or safety nets about 1,500ft above the Little Colorado River on Sunday. Scroll down for video: . Dare devil: Nik Wallenda will walk across the Grand Canyon with no harness, in a stunt shown live on television . Poise: Nik Wallenda trains for his Grand Canyon feat high above Florida . Circus act: Crowds of spectators gather to watch Wallenda practice for the stunt in Sarasota, Florida . At a height higher than the Empire State Building, the walk . will be the highest tightrope attempt ever for the 34-year-old. For two weeks, the holder of a half-dozen world records and the only person to walk on a wire over the brink of Niagara Falls, has . been practicing for what will be his biggest feat yet. The stunt by the seventh generation member of the famous Flying Wallenda acrobat family is scheduled to be . shown live on the Discovery Channel on June 23. Wallenda and his team have been trying to recreate the conditions he is likely to over the Grand Canyon. Trying conditions: Wallenda and his team use giant fans to recreate the wind speeds he is likely to encounter . One step at a time: The wire cable will stretch 1,200ft across part of the Grand Canyon . Preparations: Nik Wallenda walks on a practice wire with the Grand Canyon as his back drop, as he trains for the stunt . Although the . humid Florida heat is helping him adjust to the temperatures he is expecting, the unpredictable winds that whip through the Grand Canyon have been challenging. To try to get a feel for dealing with them, Wallenda practiced walking on his wire cable as Tropical Storm Andrea battered the Gulf Coast. His team also used air boats to create winds reaching 91mph as Wallenda walked on his hire wire. 'I'm . not scared of them,' he told the Santa Cruz Sentinel, as he walked gracefully across his wire in the specially made moccasins his mother created for him. Top of the world: Nik Wallenda walks on top of the ferris wheel at Santa Cruz broadwalk in 2011 . Dream: The member of the Flying Wallenda act achieved his childhood wish of crossing Niagara Falls last year . Stunt: Nik Wallenda crosses a wire to entertain crowds at the Nascar spring cup series in North Carolina . 'I have to respect it, but I would never do what I do if I . was scared,' he said. Wallenda, who has dreamed of doing a wire walk across the Grand Canyon for years, says his act is made possible by good mental concentration and positive thinking. 'Once I get on that wire I get very peaceful ...  I look down and look at my surroundings, I hear crowds, I hear people in the audience.' Since his first wire walk at the age of four, Wallenda he has been stung by a bee and had birds land on his balancing pole. His first experience on a wire came before he was even born, when his mother performed a sky walk while six months pregnant. In the final moments before starting one of his walks, he prays, then hugs his wife and three children, telling them he will see them in a few minutes. 'The first couple of steps are the hardest, so there's a lot of anticipation,' Wallenda, who proposed to his wife Erendira as they performed 30ft above crowds in Montreal, Canada, said. Legend: Karl Wallenda, Nik's great grandfather and source of inspiration, crosses the Tallulah Gorge in 1970 . Family act: Nik Wallenda and his sister Lijana learned to sky walk from a young age . He added: 'The hard part about doing live TV is waiting till the director says go.' The wire walker, who has written about his feats in his book Balance, uses a specially made cable, more often used for ocean dredging to perform his feats. His balance pole, which weights 43lb, is a vital piece of equipment, increasing his center of gravity and making it easier for him to adapt to conditions high above the ground. Despite his positive thinking and training however, Wallenda is well aware of the dangers of the stunt. His great-grandfather and legendary sky walker, Karl Wallenda, fell to his death at the age of 73, during a hire wire walk in Puerto Rico in 1978. The legendary sky walker has been a source of inspiration for Wallenda, who recalls on his website watching footage of the tragedy when he was four. His grandfather's belief that 'Life is on the wire, everything else is just waiting,' has stayed with Wallenda since childhood, and driven him to perform his amazing hire wire feats. Focused: Nik Wallenda says when he steps on the wire he feels calm and relaxed - even over a 1,300ft drop . The televised sky walk over Niagara last year was watched by more than 13 million Americans on ABC. However, the safety clause in the network's contract meant Wallenda had to wear a harness. 'It was my dream to walk over Niagara Falls since I was about 5 or 6 years old, but part of that dream was taken away because I had to wear that harness,' he said. 'The exciting thing about this event is that I will not be wearing any tether or any safety whatsoever.' Discovery will be filming the live stunt on Sunday in a remote section of the Grand Canyon national park, which is run by the Navajo Nation.","Sky-walker Nik Wallenda prepares to tightrope the Little Colorado River, 1,500ft above the Grand Canyon, for an unprecedented 1,200ft mark, without safety harness, amid fierce training battling Sarasota's winds. Descended from the iconic Flying Wallenda circus act, Wallenda, 34, whose great-grandfather died performing in Puerto Rico, draws inspiration from him, maintains focus through concentration, and foregoes TV network mandated harnesses. Record-breaking Niagara Falls walk attracted 13M ABC viewers, fuelling his quest for wire-walking fame on Discovery Channel, airing June 23.",2.110402107238769,finetuned-20
"By . Sarah Griffiths . PUBLISHED: . 07:56 EST, 5 December 2013 . | . UPDATED: . 09:12 EST, 5 December 2013 . It might sound like a nightmare scenario from a science fiction film, but one expert has claimed that China is planning on transforming the moon into a missile base. The expert, from the China National Space Administration's Lunar Exploration Programme Centre, told a Chinese newspaper that the moon could be used as a military base from which to fire missiles at the Earth. The alleged plans have been likened to the creation of the Death Star in the Star Wars films, a fictional space station capable of destroying planets with its giant laser and home to a huge army led by Darth Vader. Comparisons of China's alleged plans have been drawn with the Death Star in the Star Wars films (pictured), which is a fictional space station capable of destroying planets with its giant laser and home to a super army led by Darth Vader . The Beijing Times reported that discussions are ongoing in China as to whether the People’s Liberation Army could establish a missile base on the moon. One expert told the newspaper that the Earth’s natural satellite could be turned into a giant weapon, which could be used as a military base where missiles could be directed at targets on Earth, Want China Times reported. The English news website  compared the alleged plans to the building of the Death Star in Star Wars. The expert reportedly told the website that weapons testing sites could be set up on the moon but also that the Earth's satellite could become a base used to send crafts out to deep space. Earlier this week China launched its March-3B rocket carrying the Chang'e-3 lunar rover, which is known as Jade Rabbit and plans to send its first astronaut to the moon by 2030. The country hopes it will become the first country in almost 40 years to soft-land a probe on the moon. The Beijing Times reported that discussions are ongoing in China as to whether the People's Liberation Army could establish a missile base on the moon. Here, soldiers watch the live broadcast of the lift-off of the Long March-3B carrier rocket carrying China's Chang'e-3 lunar probe on December 2, 2013 in Jinan, China . The nation is only the third in history to launch an unmanned lunar probe after the Chang'e-3 device, nicknamed 'Jade Rabbit' after a Chinese folklore character, set off at 5.30pm on Sunday evening (1.30am local time). The lunar probe blasted off on board an enhanced Long March-3B carrier rocket from the Xichang Satellite Launch Center in China's southwestern Sichuan province. The probe, which can climb inclines of up to 30 degrees and travel up to 200 metres per hour, is targeted to land within a huge volcanic crater known as Sinus Iridum, which means the Bay of Rainbows, on about December 14. The mission is a huge step forward for its ambitious space programme and forms part of a plan in which China hopes to build a permanent lunar base in order to launch future missions to Mars within the next 15 years. An expert, from the China National Space Administration's Lunar Exploration Programme Centre, told a Chinese newspaper that the moon could be used as a military base from which to fire missiles at the Earth . President Xi Jinping has said he wants China to establish itself as a space superpower, and the mission has inspired widespread pride in China's growing technological prowess. State television showed a live broadcast of the rocket lifting off. If all goes smoothly, the rover will conduct geological surveys and search for natural resources after the probe touches down on the moon in mid-December. It is designed to roam the lunar surface for at least 90 Earth days – three Lunar days – covering an area of about five square kilometres. It will send probes beneath the surface as well as taking high-resolution images of the rock, a flat area formed from the molten basalt released by lunar volcanoes several billion years ago. The journey of the probe and its final landing is being closely monitored by the European Space Agency (ESA), which is cooperating closely with China. A lunar probe nicknamed Jade Rabbit blasted off on board an enhanced Long March-3B carrier rocket from the Xichang Satellite Launch Centre in China's southwestern Sichuan province (pictured)","China is considering a missile base on the Moon as suggested by China National Space Administration's Lunar Exploration Programme Centre, paralleled to the fictional Star Wars Death Star, per Beijing Times. Having recently launched its Chang'e-3 lunar rover and planning their first astronaut mission by 2030, China eyes constructing a lunar base on Sinus Iridum to facilitate Mars missions within 15 years. The nation's march towards becoming a space superpower is backed by President Xi Jinping.",1.912688970565796,finetuned-20
"By . Ian Drury for the Daily Mail . Britain may need to introduce controversial privacy laws to meet the ‘challenges’ thrown up by lightning-fast internet communications, Britain’s most senior judge has said. Lord Neuberger, who is the president of the Supreme Court, said it was time to re-think the law because information spread quickly around the globe via social media including Facebook and Twitter. His comments were interpreted as a first step towards legislating to protect people’s privacy – which critics warn would hinder the Press’s ability to investigate and expose corruption and wrong-doing. Lord Neuberger, , pictured, said the speed of new technology means we may need  to consider a privacy law . Britain has no single privacy law, unlike many other European countries. But UK judges have been accused of introducing a privacy law never debated or considered by Parliament, based only on the Human Rights Act – which contains a ‘right to private and family life’ – and their own successive judgments. The process began when law lords ruled it was wrong for a newspaper to have pictured model Naomi Campbell going to a drug rehabilitation clinic. In a speech in Hong Kong, Lord Neuberger said there had been ‘astonishing developments in IT – the ease with which information can be transmitted and received across the world, the ease with which words and scenes can be clandestinely recorded, and the ease with which information can be misrepresented or doctored.’ Media lawyer Mark Stephens said a privacy law enables 'scallywags and scoundrels' to hide their wrongdoing . He said: ‘These developments may make it inevitable that the law on privacy, indeed, the law relating to communications generally, may have to be reconsidered.’ He also gave a new interpretation on the ‘law on privacy’ in England and Wales, saying: ‘If I want to do or say something which I am only prepared to do or say privately, then it is an interference with my freedom of expression, if I cannot do it or say it because it will be reported in a newspaper.’ But Mark Stephens, a leading media lawyer, said Lord Neuberger’s intervention could be the first step towards a new privacy law in this country. He said: ’I think we can say without fear of contradiction that this is a first indication of new government policy on privacy. ‘This is very controversial. There is always a debate about whether scallywags and scoundrels use privacy laws to conceal their wrongdoing.’","Lord Neuberger, President of the Supreme Court in Britain, calls for privacy law reforms amid the rapid information spread facilitated by social media platforms like Facebook and Twitter. Criticized for potential impediment to investigative journalism, UK judges are accused of shaping a privacy law via the Human Rights Act, initially triggered by law lords' decision against Naomi Campbell's privacy breach. Media lawyer, Mark Stephens, warns of abuse potential by unethical individuals.",1.5812809467315674,finetuned-20
"Three quarters of sunbeds have failed safety tests in undercover checks by officials. Salons are using beds three times as hot as the Australian outback – putting unsuspecting clients at risk of serious skin conditions such as cancer. In the worst cases, sunbeds breached the legal limit by as much as three times, emitting UV rays too hot to ever occur on earth. Many salons are using sunbeds three times as hot as the Australian Outback - putting users at risk of skin cancer - an investigation by Trading Standards has revealed . Tanning salons, hairdressers and nail bars with sunbeds caused the most concern, while sunbeds in gyms were found to have much higher levels of compliance. Now, even the tanning industry has joined calls for tougher action against rogue operators. The latest shock figures come from North Yorkshire County Council's Trading Standards department - but there are fears the problem could be nationwide. The report revealed that 75 per cent of sunbeds failed to meet the legal limit for an acceptable level of UV radiation. Undercover officers found sunbeds emitting radiation at between 1.5 and 2.5 times the legal limit - a level hotter than the sun in the Australian Outback. The investigation began after complaints from customers that the tanning beds were too hot. It involved Trading Standards officers donning protective radiation suits to check UV levels. Tests carried out earlier this year in West Yorkshire found 89 per cent of beds failed to meet the legal safety limit. Lamps in sunbeds can use a level of UV no more powerful than the legal limit of 0.3 watts per square metre, which is the equivalent of the sun on a hot day in Spain. However, investigations in Wakefield, Bradford, Kirklees, Leeds, and Calderdale revealed some sunbeds were belting out 0.9 watts per square metre, a level of solar energy too hot ever to be found on earth. Some beds were pumping out 0.9 watts per square metre, three times the legal limit and a level of UV radiation too hot ever to be found on earth . Similarly, an inspection of all the sunbeds in North Tyneside carried out in March  found that eight out of 10 sunbed salons failed to comply with the rules. The average level of radiation they found was 0.49 watts per square metre, with at least one bed emitting 1.18 watts. Officials underlined that while 0.3 watts can be compared with a hot day on the beach in the Mediterranean, 0.9 watts is completely off the scale. The Trading Standards investigation began after complaints from customers that the tanning beds were too hot . Clare Forbes, of West Yorkshire County Council's Trading Standards department said: 'Such levels of UV radiation do not occur anywhere on the earth's surface. Not even 0.6 occurs anywhere on earth.' A Trading Standards officer for North Yorkshire County council said the beds that failed the tests were all suspended from use until the bulbs were repaired or replaced. Officers will now expand the survey to cover the whole county. They added: 'As we move into autumn officers warned people who may be tempted to use sunbeds to maintain their holiday tan, that they may be risking serious skin damage and worse.' Gary Lipman, Chairman of The Sunbed Association, joined in calls for further regulation to keep the public safe. He said: 'We welcome North Yorkshire County Council's efforts to ensure sunbed businesses are operating within the law. 'Our Code of Practice requires our members to operate to best practise but beyond our membership we are aware that not all tanning businesses operate to such high standards. 'We very much hope that now these tests have been taken, the Council uses its powers to ensure compliance, so that all sunbed businesses are operating on a level playing field. 'Only the local authority has the powers to ensure compliance and where this is properly enforced across the board, experience dictates that the vast majority of salons comply. 'We would encourage the Council to take swift action against any salon that resists compliance. 'We would always recommend that anyone looking to use a sunbed, seeks out a member of The Sunbed Association, where they are assured of receiving correct advice and information from properly trained staff about responsible tanning.'","Three quarters of sunbeds failed undercover safety tests conducted by North Yorkshire County Council's Trading Standards department, emitting UV rays up to three times hotter than the Australian Outback's highest temperatures. Areas of concern included tanning salons, hairdressers, and nail bars, while gym sunbeds demonstrated better compliance. The findings prompted the national tanning industry, led by Gary Lipman from The Sunbed Association, to urge stronger penalties for non-compliant operators. Elsewhere, West Yorkshire and North Tyneside faced similar issues, underlining industry-wide concerns.",1.979198932647705,finetuned-20
"He was one of Hollywood's finest comic talents raking in almost $10m per film at the height of his fame. But Chevy Chase, 71, looked a shadow of his former self when he appeared at the 40th anniversary of the Saturday Night Live show. In an excruciating interview with Carson Daly, Chase wiped sweat from his brow and made a garbled and confused speech to the TV anchor. Scroll down for video . A plump Chevy Chase made a confused and awkward interview while at the 40th anniversary of SNL . At the height of his career, Chase was one of America's most popular comedians and a visible celebrity . Chase, whose real name is Cornelius, rose to fame as an original member of the SNL crew in 1975 . Chase, who was part of the original Saturday Night Live crew in 1975, said: 'I left after the first year because I thought this isn't going anywhere... I liked [hosting]. I liked it. 'But I missed it more for not being a part of the cast because I left after one year, I had reasons to leave. 'I'm sorry if I'm perspiring, but I just had to run through a gauntlet. But I liked it a lot, and I still like it. I love Lorne (Michaels, the creator of the show). We're like brothers now.' Following the toe-curling chat on the red carpet, viewers on Twitter commented on the 'awkward' interview saying it was one of the most cringe-worthy things they had ever seen. They also mocked Chevy's famous catchphrase 'I'm Chevy Chase...and you're not' which he used during the Weekend Update segment of SNL. One quipped: 'He's Chevy Chase and I'm not, thank God'. Viewers watching the 40th anniversary celebrations took to Twitter to comment on the cringe-worthy chat . One viewer mocked Chase's trademark catchphrase 'I'm Chevy Chase...and you're not' in this tweet . Kevin Negandhi, from ESPN, remarked on the 'weird' interview and said he hoped Chase 'is OK' After rising to fame on SNL, Chevy - whose real name is Cornelius - embarked on a highly successful movie career in such hit comedies as Caddyshack, Three Amigos! and National Lampoon's Vacation. In the late 1980s, Chase, a father-of-three, earned around $7m per film. More recently, he campaigned for Democratic candidates Bill Clinton and John Kerry during Presidential Election races. He famously referred to George Bush as an 'uneducated, real lying schmuck dumb f***' during the 2004 Election. In 2012, Chase abruptly left the sitcom Community after a public feud with Dan Harmon, the show's creator and former executive producer. Messages Chase left on Harmon's voicemail surfaced online, revealing the actor's dissatisfaction with the direction he felt the show was taking. In one message the actor was heard saying Community was a 'mediocre sitcom' and accused Harmon of not understanding 'what it is I do that's funny'.","Comedian Chevy Chase, now 71, appeared at SNL's 40th anniversary looking markedly different, sporting a plump frame and sweating profusely during his muddled conversation with Carson Daly. Renowned as a comic genius, Chase's name, originally Cornelius, shot to fame in 1975 as a first-season SNL member. Chase left the show due to personal motives but continued as a memorable host. His career ballooned thereafter, profiting around $10m per film with hits like Caddyshack, Three Amigos! and National Lampoon's Vacation. Chase's political involvements include backing Democrats Bill Clinton and John Kerry, and, infamously, criticizing George Bush during the 2004 Election. Chase's abrasive manner resurfaced in his 2012 feud with Community's creator, Dan Harmon, leading to his abrupt exit from the sitcom.",3.5447402000427246,finetuned-20
