Article,Summary,Time,model
"He was one of Hollywood's finest comic talents raking in almost $10m per film at the height of his fame. But Chevy Chase, 71, looked a shadow of his former self when he appeared at the 40th anniversary of the Saturday Night Live show. In an excruciating interview with Carson Daly, Chase wiped sweat from his brow and made a garbled and confused speech to the TV anchor. Scroll down for video . A plump Chevy Chase made a confused and awkward interview while at the 40th anniversary of SNL . At the height of his career, Chase was one of America's most popular comedians and a visible celebrity . Chase, whose real name is Cornelius, rose to fame as an original member of the SNL crew in 1975 . Chase, who was part of the original Saturday Night Live crew in 1975, said: 'I left after the first year because I thought this isn't going anywhere... I liked [hosting]. I liked it. 'But I missed it more for not being a part of the cast because I left after one year, I had reasons to leave. 'I'm sorry if I'm perspiring, but I just had to run through a gauntlet. But I liked it a lot, and I still like it. I love Lorne (Michaels, the creator of the show). We're like brothers now.' Following the toe-curling chat on the red carpet, viewers on Twitter commented on the 'awkward' interview saying it was one of the most cringe-worthy things they had ever seen. They also mocked Chevy's famous catchphrase 'I'm Chevy Chase...and you're not' which he used during the Weekend Update segment of SNL. One quipped: 'He's Chevy Chase and I'm not, thank God'. Viewers watching the 40th anniversary celebrations took to Twitter to comment on the cringe-worthy chat . One viewer mocked Chase's trademark catchphrase 'I'm Chevy Chase...and you're not' in this tweet . Kevin Negandhi, from ESPN, remarked on the 'weird' interview and said he hoped Chase 'is OK' After rising to fame on SNL, Chevy - whose real name is Cornelius - embarked on a highly successful movie career in such hit comedies as Caddyshack, Three Amigos! and National Lampoon's Vacation. In the late 1980s, Chase, a father-of-three, earned around $7m per film. More recently, he campaigned for Democratic candidates Bill Clinton and John Kerry during Presidential Election races. He famously referred to George Bush as an 'uneducated, real lying schmuck dumb f***' during the 2004 Election. In 2012, Chase abruptly left the sitcom Community after a public feud with Dan Harmon, the show's creator and former executive producer. Messages Chase left on Harmon's voicemail surfaced online, revealing the actor's dissatisfaction with the direction he felt the show was taking. In one message the actor was heard saying Community was a 'mediocre sitcom' and accused Harmon of not understanding 'what it is I do that's funny'.","Chevy Chase, formal SNL cast member, known for classics Caddyshack and National Lampoon's Vacation, raises alarm due to awkward 40th SNL anniversary intervie. In his prime, earning nearly $10m per film, the ailing star's performance triggered concern including sweating, offbeat remarks, and confused speech pattern. The former Democrat supporter, once famously feuding with sitcom Community's creator Dan Harmon, expressed disappointment with how his comedic talents were misperceived.",1.7256100177764893,finetuned-50
"(CNN) -- It was the first tie out -- and it's the tie everyone is talking about. Manchester City will face Barcelona in the last 16 of the European Champions League in what promises to be one of the most eagerly awaited contests in this year's competition. City, which has been in irrepressible form at home in the English Premier League and won at defending champion Bayern Munich last week, had failed to reach this stage in each of its previous two attempts. Now it will face a Barcelona side which has won the tournament on four occasions -- but director of football Txixi Beguiristain says City will not fear his former club. ""I think it will be a great match,"" he told City's official website. ""Ours is a team with a lot of confidence especially after winning against the champions in Munich -- that will give us a lot of confidence. Not just at home but away as well. ""We have to be confident because of the way we are playing. We are showing that we can score in all matches. This is important in the Champions League. ""We scored in Plzen, in Moscow, in Munich -- it should give us confidence to play against a team who have been champions many times. ""Our manager knows Barcelona perfectly because he managed in Spain for a long time. In this sense, we are confident. ""I think the text messages will be flying between Manchester and Barcelona now between Sergio and Lionel! If you want to win the Champions League you have to beat the biggest teams, Barcelona are one of the biggest teams."" City has spent the past few years modeling itself on Barcelona -- now it is aiming to supplant it in Europe's top club competition. Under the management of Manuel Pellegrini, the former Villarreal and Real Madrid coach, City has progressed to the last 16 of the competition for the very first time. Backed by the riches of Sheikh Mansour, the deputy prime minister of the United Arab Emirates, City has used its financial muscle to lure those who enjoyed great success at Barcelona. Beguiristain worked at the Camp Nou from 2003-10 before joining City to work alongside Ferran Soriano, who joined following a spell with the Catalan club as vice-president. Only last January, Barcelona president Sandro Rosell accused City of trying to poach players and coaching staff from the Camp Nou. One former Barcelona player who is expected to star for City is Yaya Toure -- the midfielder who left for England in July 2010. The contest will also see City's Argentine striker Sergio Aguero, who will hope to have recovered from a calf injury after being ruled out for up to a month, go up against international teammate Lionel Messi. And while neutrals will be salivating at the prospect of the two heavyweight giants going head-to-head, Barcelona coach Gerardo Martino says both teams would have rather avoided one another. ""City will not have wanted to play against Barcelona either,"" he told reporters. ""What we need to concentrate on is being in good shape when February comes around. We need to have a high level and sustain it. ""They are scoring goals with ease so we are not going to discover them now. We want to play well in the tie and obviously win it."" Elsewhere, defending champion Bayern Munich will take on Arsenal in a repeat of last season's clash at the same stage. Bayern triumphed 3-1 in north London before squeaking through to the quarterfinals on away goals following a 2-0 home defeat. Arsenal, which sits top of the Premier League despite Saturday's 6-3 defeat at Manchester City, will provide a tough test for Bayern, according to chief executive Karl-Heinz Rummenigge. ""They are the leaders in the Premier League and so we have been warned,"" he told reporters. ""A few months ago we lost to them in Munich. They are a very tough team."" In 2012, Didier Drogba struck the winning penalty as Chelsea pulled off an unlikely Champions League triumph by defeating Bayern in the final in Munich. Now at Galatasaray, Drogba will return to Stamford Bridge to face his beloved Blues in what promises to be an emotional reunion. Chelsea manager Jose Mourinho had predicted that his side would be paired with the Turkish club, which defeated Juventus in a dramatic final group game to seal its place in the last 16. Real Madrid has been paired with German side Schalke, with Carlo Ancelotti's men still harboring ambitions of winning ""La Decima"" -- the club's 10th title. Real, which sits third in Spain, has not won the competition since 2002 and was beaten by Borussia Dortmund in last year's semifinal. Dortmund, which was beaten in last season's final by Bayern, will travel to Russia to take on Zenit St Petersburg in the first leg. Manchester United will be favorite to progress to the quarterfinal stage after being paired with Greek side Olympiakos. David Moyes' side, which finished top of its group despite unconvincing domestic form, last won the competition in 2008. Seven-time winner AC Milan has been handed a testing tie against Atletico Madrid. Milan, which has endured a dismal season in Serie A, will face an Atletico side sitting level on points with Barcelona at the top of La Liga. Elsewhere, French champion Paris Saint-Germain will travel to Bayer Leverkusen for its first leg tie. Last-16 draw: . Manchester City vs Barcelona . Olympiakos vs Manchester United . AC Milan vs Atletico Madrid . Bayer Leverkusen vs Paris Saint-Germain . Galatasaray vs Chelsea . Schalke vs Real Madrid . Zenit vs Borussia Dortmund . Arsenal vs Bayern Munich . Ties to be played February 18/19 and 25/26 with second leg games on 11, 12, 18, 19 March.","Manchester City, led by Pellegrini, will face Barcelona, under Martino, in their first-ever Champions League last 16 clash, boosted by 2-3 win against Bayern Munich. A test of former Barca executives, Txixi (City) and Ferran (also City), who mused on the team's league topping form. Notably, notable match-ups include, Yaya Toure vs. his alma-mater, and Argentina's Aguero and Messi. The tie, with dates 18/19 and 25/26 February, is a much-anticipated one.",2.212390899658203,finetuned-50
"Bosses of nuisance call companies could be hit with £500,000 fines in a Government crackdown on unwanted calls and texts. Up to one billion cold calls are received by British families each year leaving many elderly people 'too scared to answer the phone', ministers said. Culture Minister Ed Vaizey said nuisance calls were a 'plague' on families and had to stop. Ministers want to to impose tougher regulation on call centres amid growing public anger at the nuisance calls . The Government's Nuisance Calls Task Force said new rules should be introduced to make company bosses  responsible for cold-callers causing ‘severe distress’ to families. Under the plan, Payment Protection Insurance cold-callers could face fines of up to 20 per cent of their annual turnover. Which? executive director and taskforce chairman Richard Lloyd said many British firms were ‘breaking the law’. He told BBC Radio 4's Today programme the way in which the law was enforced had not been good enough. Mr Lloyd said the trade in personal data, responsible for the vast majority of nuisance calls, was ‘out of control’. He also called on regulators to clamp down on the abuse of existing legislation. ‘We want to see business with good reputations that aren't keeping a close enough eye on this making sure that there is someone senior on their board who will be held to account if those nuisance calls are being generated by that businesses activity,’ Mr Lloyd said. Between April and June this year, 40,000 people complained to the Information Commissioner about unwanted live or automated calls to their phones. Most focused on accident or PPI claims, as well as some debt consolidation company calls. The Nuisance Call Task Force said many consumers did not know that they had unwittingly given their consent to be contacted by these companies. Conservative MP Ed Vaizey, the Minister for Culture and the Digital Economy, said nuisance calls were a 'plague' Mr Vaizey said: ‘For too long, nuisance calls have plagued consumers, often at very inconvenient times of the day and in some cases, leaving vulnerable people like the elderly too scared to answer the phone. ‘That's why we're determined to tackle this scourge through the first-ever nuisance calls action plan. ‘We've already made progress, including making it easier for Ofcom to share information with the ICO about companies breaking the rules, and we're currently looking at lowering or removing the legal threshold before firms could be hit with fines of up to £500,000.’","Proposed UK legislation aims to hold directors accountable for calls causing 'severe distress', imposing £500,000 fines. Over 1 billion intrusive cold calls, distressing many elderly, have prompted Culture Minister Ed Vaizey and task force chair, Richard Lloyd, to address PPI and personal data abuse. Urging regulatory action, Lloyd seeks to target company boards and enhance existing legislation to curb this 'plague'.",2.33557391166687,finetuned-50
"By . Mail Online Reporter . PUBLISHED: . 14:46 EST, 10 November 2013 . | . UPDATED: . 14:52 EST, 10 November 2013 . Less than a week after British street artist Banksy's painting of a Nazi officer into a landscape of a mountain lake sold for $615,000, the buyer backed out. The winning bidder, who went by the online name of 'gorpetri,' failed to make good on the deal, which led New York City Housing Works thrift shop desperate for another taker. The original painting featuring a serene landscape was purchased from Housing Works a few months ago. It was then returned with the addition of a Nazi officer sitting on a bench, taking in the scene with Banksy's signature in the corner. After discovering the artist behind . their latest acquisition, the thrift shop, which benefits the homeless . and those suffering from HIV/AIDs, decided to sell the painting,'The Banality of the Banality of Evil,' at . an auction. Less than a week after British street artist Banksy's painting of a Nazi officer into a landscape of a mountain lake sold for $615,000, the buyer backed out. Bidding started off at $74,000 but sold way above that at $615,00 to 'gorpetri,' who then was unable to come up with the funds to pay his winning bid. Housing Works immediately went in search of another taker. According to Gawker the thrift store contacted the next highest bidder, who refused to pay a . bid that had been placed in competition with a fraud.' Other bidders wondered if 'gorpetri' was actually the elusive British graffiti artist playing another prank to drive up prices. They also started to complain that Housing Works was not telling the truth about how the painting made it's way to their store. People gather outside the Housing Works Thrift Shop on 23rd Street in New York City to get a glimpse of Banksy's painting - 'The Banality of the Banality of Evil.' Wil Emlingman, from Minneapolis who bid on behalf of a private buyer, told TPM that he is suspicious of Housing Works. 'They were in on it all along. They knew. Actually, Banksy's people actually contacted them saying, 'Hey, we're looking for a landscape piece, we want to paint a monster on it,' Emling said. 'So the whole story about somebody buying it weeks ago and then somebody coming and dropping it off and telling them, 'I need to speak with the manager, you have a very expensive piece on your hands here,' isn't the case.' But Housing Works and Banksy's PR team deny all of the claims. A spokesperson from Housing Works said that they had no idea who the man was when he dropped off the 'vandalized' painting last month. 'I don't know all the details, it was all done very secretively. But someone came in and dropped it off as an anonymous donation,' Housing Work's Rebecca Edmondson told The New York Post. The thrift store was able to eventually find a buyer. They sold the painting to an anonymous individual who paid 'at least $450,000,' according to Gawker. Before the auction, Housing Works hung the painting in their store on 23rd Street. Bidding started off at $74,000 but sold way above that at $615,00 to 'gorpetri,' who then was unable to come up with the funds to pay his winning bid. 'It was one of the largest gifts Housing Works has ever received and we're thrilled,' Housing Work's chief development officer, Matthew Bernardo, told TPM. 'We're thankful that he chose us as an emblem of New York to give his donation to.' The charity donation marked the conclusion of the British artist's self-imposed 'residency' in New York, where he debuted a new piece of art every day during the month of October. Banksy ended his month-long residency on the streets of New York with an inflatable tag on the Long Island Expressway in Queens. The last piece from Better Out Than In sits above other tags in a used car lot. Cops took down the balloons. One exception was made on October 23 when he posted on his website that the day's art had 'been cancelled due to 'police activity'. The philanthropic turn came after he penned an op-ed slamming the 'Freedom Tower' design that is replacing The World Trade Center. His critique- where he called the building a 'shyscrapper'- landed him in hot water with New Yorkers.","Buyer 'gorpetri' failed to honor $615k winning bid for Banksy's 'The Banality of the Banality of Evil'. NYC Housing Works, soliciting new buyers, sold the piece to an anonymous individual for 'at least $450k'. Disputes arose on its origin, with some alleging collusion between Housing Works and Banksy, while others speculated if 'gorpetri' was the artist himself. Post the controversial sale, acclaimed artist Banksy concluded his month-long 'residency' with a N.Y. Times op-ed critiquing 'Freedom Tower'.",2.1371469497680664,finetuned-50
"Our galaxy can be a very dusty place, and supernovae are thought to be a main source of that dust - especially in the early universe. But up until now, there has been very little direct evidence of a supernova's dust‐making capabilities. The little evidence astronomers did have could not account for the massive amount of dust detected in young, distant galaxies. Now new images of the famed Supernova 1987A have, for the first time, captured the remains of the exploding star brimming with freshly formed dust. This artist's illustration shows Supernova 1987A, based on real data with the cold, inner regions of the exploded star's remnants (in red) where tremendous  amounts of dust were detected and imaged. This inner region is contrasted with the outer shell (lacy white and blue circles), where the blast wave from the supernova is colliding with the envelope of gas ejected  from the star prior to its powerful detonation . If enough of this dust makes the perilous transition into interstellar space, it could explain how many galaxies acquired their dusty, dusky appearance. ‘We have found a remarkably large dust mass concentrated in the central part of the ejecta from a relatively young and nearby supernova,’ said Remy Indebetouw, an astronomer at the National Radio Astronomy Observatory (NRAO) in Charlottesville. ‘This is the first time we've been able to really image where the dust has formed, which is important in understanding the evolution of galaxies.’ An international team of astronomers used the Atacama Large Millimeter/submillimeter Array (ALMA) telescope to observe the glowing remains of Supernova 1987A. This image shows the remnant of Supernova 1987A  in light of very different wavelengths. The ALMA Telescope data (in red) shows newly formed dust in the centre of the remnant as Hubble (in green) and Chandra (in blue) data show the expanding shock wave . In February of 1987 astronomers observing the Large Magellanic Cloud, a nearby dwarf galaxy, noticed the sudden appearance of what looked like a new star. In fact they weren’t watching the beginnings of a star but the end of one and the brightest supernova seen from Earth in the four centuries since the telescope was invented. By the next morning news of the discovery had spread across the globe and southern hemisphere stargazers began watching the aftermath of this enormous stellar explosion, known as a supernova. In the two and a half decades since then, the remnant of Supernova 1987A has continued to be a focus for researchers around the world, providing a wealth of information about one of the Universe’s most extreme events. Located more than 160,000 light years away, the light of the catastrophic explosion only reached Earth in February 1987. Before it exploded, the star generated huge amounts of gas, including a thick, dense, clumpy ring more than a light year across. Astronomers predicted that as the gas cooled after the explosion, large amounts of dust would form as atoms of oxygen, carbon, and silicon bonded together in the cold central regions of the remnant. However, earlier observations of SN 1987A with infrared telescopes, made during the first 500 days after the explosion, detected only a small amount of hot dust. Using, the research team was able to image the far more abundant cold dust, which glows brightly in millimetre and submillimetre light. The astronomers estimate that the remnant now contains about 25 per cent the mass of the sun in newly formed dust. They also found that significant amounts of carbon monoxide and silicon monoxide have formed. ‘SN 1987A is a special place since it hasn't mixed with the surrounding environment, so what we see there was made there,’ said Dr Indebetouw. ‘The new ALMA results, which are the first of their kind, reveal a supernova remnant chock full of material that simply did not exist a few decades ago.’ Supernovae, however, can both create and destroy dust grains. As the shockwave from the initial explosion radiated out into space, it produced bright glowing rings of material, as seen in earlier observations with the Hubble Telescope. After hitting this envelope of gas, which . was sloughed off by the progenitor red giant star as it neared the end . of its life, a portion of this powerful explosion rebounded back towards . the centre of the remnant. Last year, a team of astronomers led by the International Centre for Radio Astronomy Research (ICRAR) produced incredible high resolution radio images of the expanding SN 1987A remnant at millimetre wavelengths. In this image contours of different wavelengths of radio emissions and a Hubble space telescope image of Supernova 1987A combined to provide a unique view of its death throes . Cosmic dust consists of tiny particles of solid material floating around in the space between the stars. Unlike the dust you find in your house, it is more like smoke with small particles varying from collections of just a few molecules to grains of 0.1 mm in size. D . It helps stars form, and it is also the raw material from which planets like the Earth are created. Supernovae are thought to be a main source of that dust - especially in the early universe. But . up until now, there has been very little direct evidence of a . supernova's dust‐making capabilities, and could not account for the . massive amount of dust detected in young, distant galaxies. ‘At some point, this rebound shockwave will slam into these billowing clumps of freshly minted dust,’ said Dr Indebetouw. ‘It's likely that some fraction of the dust will be blasted apart at that point. It's hard to predict exactly how much — maybe only a little, possibly a half or two thirds.’ If a good fraction survives and makes it into interstellar space, it could account for the copious dust astronomers detect in the early universe. ‘Really early galaxies are incredibly dusty and this dust plays a major role in the evolution of galaxies,’ added Mikako Matsuura of University College London, UK. ‘Today we know dust can be created in several ways, but in the early universe most of it must have come from supernovae. We finally have direct evidence to support that theory.’ In 1987 astronomers observing the Large Magellanic Cloud, a nearby dwarf galaxy, noticed the sudden appearance of what looked like a new star. In fact they weren’t watching the beginnings of a star but the end of one and the brightest supernova seen from Earth in the four centuries since the telescope was invented. By the next morning news of the discovery had spread across the globe and southern hemisphere stargazers began watching the aftermath of this enormous stellar explosion, known as a supernova. In the two and a half decades since then, the remnant of Supernova 1987A has continued to be a focus for researchers around the world, providing a wealth of information about one of the Universe’s most extreme events. Last year, a team of astronomers led by the International Centre for Radio Astronomy Research (ICRAR) produced incredible high resolution radio images of the expanding SN 1987A remnant at millimetre wavelengths. Supernova 1987A was the closest exploding star seen in modern times. It occurred in the Large Magellanic Cloud, a small galaxy that orbits our own Milky Way. Images taken by Nasa's Hubble Space Telescope were combined to make this composite of the blast's expanding debris .","Supernova 1987A, the brightest since the invention of the telescope, provides direct evidence of supernovae's dust-making capacity. Recently, the Atacama Large Millimeter/submillimeter Array (ALMA) telescope captured the inner regions of Supernova 1987A packed with dust, suggesting supernovae like it produce abundant cosmic dust. This verifies a longstanding theory, aids in understanding galaxy evolution, and can potentially explain the dusty appearance of early galaxies. Remy Indebetouw from the National Radio Astronomy Observatory (NRAO) states knowledge of dust formation at SN 1987A is vital.",2.947808027267456,finetuned-50
