Article,Summary,Time,model
"These unique photographs taken during the First World War by a British sailor show the biggest manmade explosion in history, when two warships crashed into one another, killing 2,000 people. The photos, taken by Royal Navy Lt Victor Magnus, have emerged nearly 100 years after they were taken and show the moment a French and Norwegian ship dramatically collided in what has become known as 'The Halifax Explosion'. During the incident, the SS Mont-Blanc - a ship from France fully loaded with wartime explosives - collided with SS Imo from Norway. The French ship then blew up, nearly wiping out an entire district. A set of unique photographs taken during the First World War by a British sailor shows the biggest manmade explosion in history . The images show the moment two warships collided into each another in December 1917, triggering an explosion which killed nearly 2,000 people . During the incident, the SS Mont-Blanc - a ship from France fully loaded with wartime explosives - collided with SS Imo from Norway . Experts say the blast was the largest manmade explosion prior to the development of nuclear weapons - with an equivalent force of roughly 2.9 kilotons of TNT. Amateur photographer Victor, who was based in Halifax in the Canadian state of Nova Scotia, was said to 'always had a camera around his neck' and was able to grab a series of shots of the original 'big bang'. The photos have now been found by his daughter Ann Foreman, 89, who discovered them among photo albums in a drawer. She had no idea a slice of history had been gathering dust in her home for nearly 100 years. Mrs Foreman, from Hayle in Cornwall, who served in the land army, will take them to the Imperial War Museum, London, next month to have the photos looked at. She said: 'My father was a great photographer. He always had a camera around his neck. He would take photos all the time. He never asked anyone to pose or anything. He just snapped away. 'It was just a coincidence that he was at the Halifax disaster. The actual explosion was a a massive amount of smoke. Experts say the blast, the aftermath of which is shown here, was the largest manmade explosion prior to the development of nuclear weapons . 'The Halifax Explosion' had an equivalent force of roughly 2.9 kilotons of TNT and left a a trail of destruction in its wake . The photos were taken by Royal Navy Lt Victor Magnus, in Halifax, Nova Scotia, - the young sailor 'always had a camera around his neck' 'He was very lucky to survive, especially as it destroyed the town. He took some photos on the shore and it looked like the London Blitz. 'The whole situation of finding the photos has made it very real. I'm just so proud of him. He never talked about this and this is the first time seeing them. It's extraordinary.' After the war, Victor went back to his job as a Marine Underwriter in Essex, before serving in the home guard during the Second World War. Although later leaving the role to become an apple farmer, he always loved the sea and was the Commodore of Essex Yacht Club. He was married for his whole life, had three children and six grandchildren, and died in 1969. The photos have now been found by his daughter Ann Foreman, 89, from Hayle, Cornwall, who discovered them among photo albums . The explosion, at 9.04am on Thursday December 6, 1917, happened in the the Narrows, a strait connecting the upper Halifax Harbour to Bedford Basin. A fire on board the French ship then ignited her explosive cargo causing a cataclysmic explosion that devastated the Richmond District of Halifax. It was so powerful it almost wiped out the entire town and around 2,000 people were killed by debris, fires, and collapsed buildings and more than 9,000 injured. 1. N1 heavy lift rocket launch explosion on 3 July 1969: 7 kt of TNT (29 TJ) 2. Minor Scale and Misty Picture nuclear simulations on 27 June 1985; 14 May 1987 - 4.8 kt of TNT (20 TJ) 3. Heligoland on 18 April 1947: 3.2 kt of TNT (13 TJ) 4. Halifax Explosion on 6 December 1917: 2.9 kt of TNT (12 TJ) 5. Texas City Disaster on 16 April 1947: 2.7-3.2 kt of TNT (11-13 TJ) 6. Evangelos Florakis Naval Base explosion on 11 July 2011: 2-3.2 kt of TNT (9-13 TJ) 7. Port Chicago disaster on 17 July 1944: 1.6-2.2 kt of TNT (7-9 TJ) Two ships, one loaded with explosive, struck each other while the town shock with horror. SS Mont Blanc was described as a huge 'floating bomb' because of her formidable cargo. There were more than 2,000 tonnes of picric acid, 200 tonnes of TNT, 56 tonnes of gun cotton and 223 tonnes of motor fuel on board. Records show the ship exploded and disintegrated in seconds. Altogether 3.8 sq km (1.5 sq miles) of Halifax was flattened in an instant and more than 1,900 people perished. The SS Mont Blanc was completely destroyed, with its hull launched 1,000ft in the air, while the SS Imo survived and returned to service in 1918. As the ships collided, Lt Montague was on the shore with his camera in hand, snapping the event. His daughter is expected to visit the Imperial War Museum on December 2, where an expert will talk through the photos with her. Dr Robb Robinson, a lecturer in Maritime History at Hull University, said: 'It was 1917 and the Germans had just unleashed submarine warfare, causing massive problems for the allies. There was a big push by the Germans to win the war. 'To try and stop this, the allies launched a convoy system with ships staying sailing close to each other. This left them vulnerable to collision. 'Secondly, so many ships had been sunk that ships that weren't right for the job were being used. 'Thirdly, they were drawing increasingly on Canada and the USA for ammunition, so ships were being filled with ammunition before sailing over. 'It lead to the most devastating explosion there had every been at the time. Before Hiroshima, every explosion was judged on how it compared to Halifax. 'This explosion was a precursor of things to come throughout the century.'","Photographs taken by Royal Navy Lt Victor Magnus reflect 'The Halifax Explosion,' the largest man-made blast witnessed in 1917 during World War I. Colliding in the Halifax Harbor Narrows, French SS Mont-Blanc and Norwegian SS Imo, packed with wartime explosives, caused a 2.9 kt explosion. Local casualties totaled 2,000 with 9,000 injured and vast destruction across a 3.8 sq km area. Despite SS Mont-Blanc's wreckage launch of over 300 meters, SS Imo returned to duty. Victor Magnus's daughter, Ann Foreman, plans to present the archival finds to London's Imperial War Museum.",3.8081672191619873,finetuned-20
"By . Sara Nathan . Robert F Kennedy Junior will marry actress Cheryl Hines within weeks - despite allegations that he cheated on her, MailOnline can reveal. It is claimed the environmental lawyer had an affair with Chelsea Kirwan, the estranged wife of surgeon to the stars Laurence Kirwan behind the back of his fiancée Cheryl Hines. The pair were pictured together at an event in Seattle in April 2013 and their friendship is believed to have spanned the past two years. However, a source confirmed Bobby and Cheryl are most certainly still getting married. Engaged: Actress Cheryl Hines is ready to wed Robert F Kennedy Jr this summer during the Kennedys annual reunion in Hyannis Port - despite allegations of his infidelity . Tying the knot: RFK Jr, an environmental lawyer, revealed hjs engagement to Curb Your Enthusiasm actress Chery Hines in April at Muhammad Ali's Celebrity Fight Night in Phoenix, Arizona . Indeed, the source confirmed that preparations are 'far down the line' for the nuptials, adding: 'There has been no concrete proof of this affair.' RFK Jf, who is in Cuba on work this week, and Curb Your Enthusiasm star Cheryl are believed to be tying the knot at the Kennedy compound in Hyannis Port, Mass, this summer, during the family's annual reunion. Close friends and family, including RFK Jr's mother Ethel Kennedy, 86, will be in attendance. Cheryl, 48, is said to be extremely close to the Kennedy scion's six children, in particular his teenage daughter Kyra, 19, who has been living with Cheryl in Los Angeles following the tragic death of her mother Mary Richardon in May 2012. MailOnline told this week how Bobby, 60, and Chelsea, 42, met in a gym in Armonk, New York. Chelsea, a mother-of-four, is currently going through a bitter divorce from Laurence Kirwan a high-profile surgeon with offices in London, New York and Connecticut. And a source close to Prof Kirwan, 62, told MailOnline: ‘He was well aware . that his wife and Bobby had a friendship before their split and that . they have had ongoing telephone calls.’ It is believed a friendship started well before the Kirwans separated on July . 4, 2012 - and a source reveals how Chelsea’s cell phone records show she was . speaking to RFK Jr five times a day in August 2012. The exact nature of Chelsea’s relationship with RFK Jr could well come out in court next month when Prof Kirwan will appeal to try and modify the protection order currently in place over his visitation rights with his three children with Chelsea, 42. The case will be heard on July 22 in Connecticut. Indeed, a source now tells MailOnline that Prof Kirwan's lawyers could in fact be planning to depose RFK Jr and question him under oath as to the exact nature of his relationship with Chelsea. Estranged: Surgeon to the stars Laurence Kirwan and his soon to be ex wife Chelsea at a party. Sources close to Prof Kirwan claimed the mother of three of his children had an 'inappropriate' relationship with Robert F Kennedy Jr . RFK . Jr began dating Cheryl in 2012, months before . his estranged wife, Mary Richardson, tragically committed suicide in May . 2012 at their Mount Kisco, New York home aged just 52. The couple are expected to tie the knot this summer during the Kennedys' annual reunion in Hyannis Port. And asked about their relationship, Cheryl said recently: . 'We share the same values. Family first. We like to have a good time and . work hard. It’s fun to have a partner...It’s a good match-up.' Meanwhile, Prof Kirwan and his estranged wife split on July 4, 2012, prompting a bitter divorce. Then . in August 2012, the surgeon was charged with attacking Chelsea and his . step daughter in an angry confrontation at their family home in . Connecticut, a six-bedroom, $5.9 million property complete with swimming pool. 'We share the same values': Cheryl Hines - pictured with Robert F Kennedy Jr at the Deer Valley Celebrity Skifest in Utah in December 2012 - spoke out about their upcoming marriage, saying: 'It's fun to have a partner. It's a good match up.' Tragic: RFK Jr with his second wife, Mary Richardon, who killed herself in May 2012. The former couple are seen, left, at a dinner at the Ripple of Hope Gala in NYC in November 2010 - and, right, at the Deer Valley Celebrity Skifest in Utah in December 2008 . But he later turned himself in to police, and was arrested and placed in custody. He . was charged with third degree assault and disorderly conduct against . his alleged victims - Chelsea and her daughter Tailor, then 18, now 20. Admitting to indiscretions,Prof Kirwan nonetheless said: ‘I have the greatest respect for my wife and I . have tried hard to save my marriage. I still want to do everything . possible to work it out.’ There . are now new attorneys working on the divorce case following a mistrial . and Prof Kirwan and his wife have a court date in September of this . year. In November, the . charges will be dropped as he will have completed his two years . probation, if he successfully adheres to the protection order and the . guidelines set by the court. When reached by MailOnline, Prof Kirwan declined to comment, while Chelsea Kirwan Chapman declined to comment. While a spokeswoman for Cheryl also declined to comment when contacted. Going strong: The actress has been dating Robert Kennedy Jr since 2012 and happily brought him along when she was honored with a star on the Hollywood Walk of Fame in January . Adore: Robert Kennedy Jr's kids are said to adore Cheryl Hines. The couple pose with his daughter Kyra as the actress is honored with a star on the Hollywood Walk of Fame in January .","Despite alleged affair with surgeon Laurence Kirwan's estranged wife Chelsea Kirwan, Robert F. Kennedy Jr. plans to wed Curb Your Enthusiasm actress Cheryl Hines in Hyannis Port, Massachusetts this summer. Kennedy, an environmental lawyer, and Hines, 48, publicly announced their engagement at Muhammad Ali's Celebrity Fight Night in April, 2014. Chelsea and Bobby reportedly met in an Armonk, NY gym in August 2012 – a month Chelsea exchanged five daily phone calls with him. Kennedy, a father of six, lost his second spouse Mary Richardson (52) to suicide in May 2012.",2.606203079223633,finetuned-20
"Black clouds, spectacular lightning strikes and howling thunder have rolled across Sydney, signalling an end to a glorious weekend stretch of hot, sunny weather. The weather turned quickly on Monday afternoon as apocalyptic-looking clouds descended on the city - and more is expected along Australia's east coast over the next 24 hours. It comes as hilarious footage emerged of a woman reacting to a huge lightning strike during a storm - and went viral after it was uploaded to YouTube. When Mother Nature put on a dramatic display last week over Newcastle, north of Sydney, the woman couldn't contain herself, shrieking as she ran inside for cover. Scroll down for video . Ready for action. A cameraman gets set to record the wild weather across the harbour city . Getting a head start on the commute? The weather turned quickly from bright and sunny to dark and stormy . Spectacular lightning was seen across Sydney on Monday afternoon . Sydney streets are clogged with traffic this afternoon as the storm clouds roll across the city . An eerie build-up beyond the city as a swirl of clouds seems to swallow up the last of the day's sunlight . Sweeping through. The view from an apartment block as the dark clouds move in as a severe storm cell prepares to hit Sydney for the second time in 24 hours . Lightning strikes are being posted on social media as Sydney suffers a second series of thunderstorms in less than 24 hours . In her post, Locke Hart, says that 'lightening (sic) hits the house 4 doors down from me ultimately causing an electrical fire. Thank goodness for our fire fighters tho! 'What wacky weather today! Yeah I sound like a sissy, but I thought it was kind of funny lol.' Up to 10,000 homes were blacked out as a result of the late Sunday storms which swept through northern New South Wales. A number of fires are also burning across the state after being sparked by lightning strikes. Scroll down for more video . Australia's east coast is bracing for more storm activity in the next 24 hours and storm watchers best beware, as a woman in Newcastle proved that sometimes getting too close, can be a health hazard . More than 10,000 homes were blacked out as a result of the late Sunday storms which swept through northern New South Wales . A number of fires are also burning across the state after being sparked by lightning strikes . The NSW Rural Fire Service (RFS) reports that it is battling 90 blazes so far, 47 of which are deemed out of control. Most were caused by lightning strikes late on Sunday that followed scorching temperatures in Sydney and around the state, NSW RFS spokesman Ben Shepherd said. The Bureau of Meteorology reported that the unsettled conditions were being caused by a slow-moving low-pressure trough, with forecast of storms in southern and western parts of the state. Peter Zmijewski, senior meteorologist at Bureau of Meteorology, told Daily Mail Australia that the high temperatures were not unseasonal but because of the changing seasons. He said: 'This time of the year it’s a transition in the season and there are a lot of adjustments going on, this is why we can experience very hot and cold in the same day.' The November to January temperature outlooks indicate a warmer than normal season for both daytime and night-time temperatures across most of Australia. 'There's a build up of heat due to the clear sunny days which has allowed heat to build,' said Weatherzone meteorologist Kim Westcott. 'The heat is slowly moving ahead of a slow pressure trough.' 'It's not unusual, it's the summer pattern arriving and we have a lot of moisture in the air,' said Ms Westcott. According to the Weather Bureau, this time of the year it’s a transition in the season and there are a lot of adjustments going on, this is why Australians can experience very hot and cold in the same day . Up to 10,000 homes were blacked out by the fierce Newcastle storm on Sunday . The Bureau also states that 'the Pacific Ocean has shown some renewed signs of El Niño development in recent weeks'. 'Above-average temperatures in the tropical Pacific Ocean have warmed further in the past fortnight.'","Black clouds, thunderstorms, lightning strikes, and traffic congestion hit Sydney. Viral footage shows a shrieking woman at Newcastle's storm, while storm-related fire burnt 10,000 homes in New South Wales. With temperatures surging due to a slow pressure trough, the Bureau of Meteorology mentions El Niño's likely return with a transition in seasons triggering erratic hot-cold weather.",1.498302936553955,finetuned-20
"By . Nick Fagge . PUBLISHED: . 09:46 EST, 28 May 2012 . | . UPDATED: . 19:10 EST, 28 May 2012 . Liverpool is the whiplash capital of Britain with one in every 50 residents making compensation claims. Figures from the Department for Work and Pensions show huge regional variations in case rates – clear evidence of fraud in the eyes of industry experts. Whiplash claims cost insurers  £2billion a year, with bogus payouts adding £90 to the typical car insurance premium. Whiplash: Bogus claims cost the insurance industry £2¿billion a year and have raised the annual insurance premium for every motorist by £90 . In the 12 months to March, the number of cases in Liverpool was 22 per thousand residents. Uxbridge in West London and Oldham were close behind with 21 and 20 per thousand. Those figures are twice the national average of nine per thousand and 20 times the level seen in some areas. The lowest rates were in Scotland, where there are strict controls on referral fees paid to garages and insurance brokers in such cases. A survey of GPs last year showed that 25 per cent of the 550,000 annual claims are ‘fake or over-diagnosed’. At least 30,000 – 6 per cent – are outright fraudulent, according to the Insurance Fraud Bureau.UK insurers receive 1,200 whiplash claims a day, twice the level in other European countries. Malcolm Tarling, of the Association of British Insurers, said: ‘This is the first time there has been a regional breakdown of where whiplash claims are being made. ‘And there appears to be a striking correlation between whiplash victims and the number of lawyers specialising in personal injuries claims. ‘Whiplash claims have gone up by a third in the past three years while the number of accidents has gone down. ‘Either we have developed the weakest necks in Europe or drivers are regarding whiplash injury claims as easy money waiting to be collected.’ Aviva has called for a radical overhaul of the system, saying the compensation culture encourages bogus claims. Dominic Clayden, claims director for the insurer, said: ‘We operate in a legal system that encourages claimants to “have a go” – there is no financial risk for even the most minor whiplash claim to be brought. 'However, this “whip-cash” is not free. It is not coincidence that premiums have increased as whiplash claims have skyrocketed over recent years. ‘The UK needs urgent reform of the system so genuine claimants get the compensation and help they deserve, but minor incidents that hardly give rise to an injury are not penalising motorists through inflated premiums. Crackdown: The nationwide issue was brought to light by Justice Secretary Kenneth Clarke who has held a 'Whiplash Summit' in Parliament in a bid to crack down on the crooks . ‘The Ministry of Justice needs to increase the small claims limit to £5,000, meaning that minor whiplash claims would not need to involve lawyers. We also believe that the damages paid for whiplash injuries need to be reduced and capped.’ But John Spencer, of personal injury specialist Spencer’s Solicitors, said: ‘There are some cases that are spurious and fraudulent and every professional legal firm wants to put a stop to that. ‘But you have got to make sure that people who are injured are properly compensated.’ Last night a Department for Transport spokesman said: ‘Car insurance costs are simply too high, they must be reduced. ‘The Government has already taken tough action to ban referral fees, reform no win no fee rules and crack down on fraudulent whiplash claims. ‘But we must go further and by working together with drivers and the industry the Government is determined to bring some common sense back and get premiums down.’ Whiplash is caused when the head moves suddenly, damaging ligaments and tendons in the neck – a common injury in a car accident. However it is difficult to diagnose and doctors must rely on the patient’s description of their symptoms.","UK law firm, Spencer’s Solicitors’, Director, John Spencer, endorses Government action against fraudulent whiplash claims following regional split revealed by Association of British Insurers’ Malcolm Tarling that Liverpool boasts 22 cases per thousand residents, generating £2bn annual losses for insurers, adding £90 to motorist premiums. Aviva’s claims director, Dominic Clayden, urges reforms including raising small claims cap to £5,000.",1.5958948135375977,finetuned-20
"Islamist militants in Nigeria's restive north have taken the lives of 34 people since Christmas, including 27 Christians attending church services. On Tuesday, the country's military took the fight to Boko Haram's stronghold, killing 13 suspected combatants. Read more: Nigeria guilty of abuses in pursuing Boko Haram militants . Joint Task Force Operation Restore Order lost one soldier during the afternoon gunfight in the isolated town of Maiduguri in Nigeria's far northwest corner, said spokesman Sagir Musa. The task force condemned alleged Boko Haram attacks going back to July 2012 in a statement, calling them ""incessant callous, brutal, barbaric and impious killings."" These included attacks on mosques, churches and businesses. Human Rights Watch said the militant group has killed more than 2,800 people in all. On Christmas Eve, attackers raided two churches, killing 12 people and setting one of the churches alight.  Six days later, suspected Boko Haram fighters killed at least 15 Christian worshipers, slitting some of their throats, according to Nigerian authorities. Read more: 22 killed in three attacks in Nigeria . Boko Haram carried out its largest known massacre in January 2012 killing 211 through coordinated bombings and gun assaults in the northern city of Kano, a popular target.  The group often attacks Nigerian police stations. The name Boko Haram means ""Western education is sacrilege."" In the past, they have attacked other Muslims they felt were on an immoral path but have increasingly killed Christians. The U.S. State Department has accused Boko Haram of attacking mosques and churches to incite tensions between the two religious groups, hoping to drive a wedge between them. It has condemned some of the group's leaders for alleged ties to al Qaeda. Read more: Opinion: Nigeria is a sinking ship, but we must not desert it .","A spate of Boko Haram attacks in northeast Nigeria's Maiduguri, season from Christmas, claimed 34 lives, including 27 churchgoing Christians. A military offensive, killing 13 extremists at their stronghold, aimed to subdue the Islamist militants. The Joint Task Force Operation Restore Order accused the group of 2,800 fatalities, ranging from targeted church and mosque strikes to commercial areas since July 2012. Boko Haram, criticised by the U.S. State Department for triggering religious tensions through Quranic and church assaults, had previously targeted Kano city and police stations.",3.351092338562012,finetuned-20
